{
  "schema": "zerone.standard-profile/v0",
  "profile_id": "zerone.release.slsa-build-l2",
  "profile_version": "0.1.0",
  "title": "Zerone reproducible release adaptation",
  "status": "DRAFT",
  "assurance_mode": "SHADOW_ONLY",
  "standards": [
    {
      "uri": "https://slsa.dev/spec/v1.2/",
      "version": "1.2",
      "status": "APPROVED",
      "target": "Build L2"
    },
    {
      "uri": "https://github.com/in-toto/attestation/blob/v1.2.0/spec/v1/statement.md",
      "version": "1.2.0",
      "status": "STABLE",
      "target": "Statement layer"
    },
    {
      "uri": "https://slsa.dev/spec/v1.2/build-provenance",
      "version": "1.2",
      "status": "APPROVED",
      "target": "Build provenance v1 predicate semantics"
    }
  ],
  "requirements": [
    {
      "id": "ground.problem-contract",
      "kind": "PROBLEM_CONTRACT",
      "verification_rule": "FROZEN_BASELINE_AND_GUARDRAILS",
      "policy_digest": "sha256:1111111111111111111111111111111111111111111111111111111111111111",
      "observer_role": "SPONSOR",
      "min_count": 1,
      "min_independent_control_clusters": 1,
      "require_observer_independent_from_claimant": true,
      "hard_guardrail": true
    },
    {
      "id": "ground.signed-provenance",
      "kind": "SIGNED_PROVENANCE",
      "verification_rule": "SIGSTORE_SIGNATURE_AND_SUBJECT",
      "policy_digest": "sha256:2222222222222222222222222222222222222222222222222222222222222222",
      "predicate_type": "https://slsa.dev/provenance/v1",
      "observer_role": "VERIFIER",
      "min_count": 1,
      "min_independent_control_clusters": 1,
      "require_observer_independent_from_claimant": true,
      "hard_guardrail": true
    },
    {
      "id": "ground.rollback-safety",
      "kind": "ROLLBACK_DRILL",
      "verification_rule": "ROLLBACK_COMPLETED",
      "policy_digest": "sha256:3333333333333333333333333333333333333333333333333333333333333333",
      "observer_role": "OPERATOR",
      "min_count": 1,
      "min_independent_control_clusters": 1,
      "require_observer_independent_from_claimant": false,
      "hard_guardrail": true
    },
    {
      "id": "standard.slsa-build-l2",
      "kind": "CONFORMANCE_RESULT",
      "verification_rule": "SLSA_BUILD_V1_EXPECTATIONS",
      "policy_digest": "sha256:4444444444444444444444444444444444444444444444444444444444444444",
      "predicate_type": "https://slsa.dev/provenance/v1",
      "observer_role": "VERIFIER",
      "min_count": 1,
      "min_independent_control_clusters": 1,
      "require_observer_independent_from_claimant": true,
      "hard_guardrail": true
    },
    {
      "id": "capability.independent-rebuild",
      "kind": "INDEPENDENT_REBUILD",
      "verification_rule": "BYTE_IDENTICAL_SUBJECT",
      "policy_digest": "sha256:5555555555555555555555555555555555555555555555555555555555555555",
      "observer_role": "VERIFIER",
      "min_count": 2,
      "min_independent_control_clusters": 2,
      "require_observer_independent_from_claimant": true,
      "hard_guardrail": false
    },
    {
      "id": "capability.causal-gain",
      "kind": "CAUSAL_EVALUATION",
      "verification_rule": "CAUSAL_HOLDOUT_GAIN",
      "policy_digest": "sha256:6666666666666666666666666666666666666666666666666666666666666666",
      "observer_role": "VERIFIER",
      "min_count": 2,
      "min_independent_control_clusters": 2,
      "require_observer_independent_from_claimant": true,
      "hard_guardrail": true
    },
    {
      "id": "industrial.interoperability",
      "kind": "INTEROPERABILITY_RESULT",
      "verification_rule": "INTEROPERABILITY_SUITE_PASS",
      "policy_digest": "sha256:7777777777777777777777777777777777777777777777777777777777777777",
      "observer_role": "VERIFIER",
      "min_count": 2,
      "min_independent_control_clusters": 2,
      "require_observer_independent_from_claimant": true,
      "hard_guardrail": true
    },
    {
      "id": "industrial.production-slo",
      "kind": "PRODUCTION_SLO",
      "verification_rule": "SLO_AND_GUARDRAILS_PASS",
      "policy_digest": "sha256:8888888888888888888888888888888888888888888888888888888888888888",
      "observer_role": "OPERATOR",
      "min_count": 1,
      "min_independent_control_clusters": 1,
      "require_observer_independent_from_claimant": false,
      "hard_guardrail": true
    },
    {
      "id": "industrial.rollback-drill",
      "kind": "ROLLBACK_DRILL",
      "verification_rule": "ROLLBACK_COMPLETED",
      "policy_digest": "sha256:9999999999999999999999999999999999999999999999999999999999999999",
      "observer_role": "OPERATOR",
      "min_count": 1,
      "min_independent_control_clusters": 1,
      "require_observer_independent_from_claimant": false,
      "hard_guardrail": true
    },
    {
      "id": "industrial.independent-adoption",
      "kind": "INDEPENDENT_ADOPTION",
      "verification_rule": "INDEPENDENT_ADOPTION_RECEIPT",
      "policy_digest": "sha256:dddddddddddddddddddddddddddddddddddddddddddddddddddddddddddddddd",
      "observer_role": "ADOPTER",
      "min_count": 3,
      "min_independent_control_clusters": 3,
      "require_observer_independent_from_claimant": true,
      "hard_guardrail": false
    },
    {
      "id": "recursive.useful-work",
      "kind": "ZERONE_RECURSIVE_VALUE",
      "verification_rule": "ZERONE_RECURSION_LINK",
      "policy_digest": "sha256:eeeeeeeeeeeeeeeeeeeeeeeeeeeeeeeeeeeeeeeeeeeeeeeeeeeeeeeeeeeeeeee",
      "observer_role": "VERIFIER",
      "min_count": 2,
      "min_independent_control_clusters": 2,
      "require_observer_independent_from_claimant": true,
      "hard_guardrail": false
    }
  ],
  "nodes": [
    {
      "id": "ground.problem-contract",
      "stage": "GROUND",
      "tier": "E0_ASSERTED",
      "title": "Frozen problem contract",
      "prerequisites": [],
      "requirement_ids": [
        "ground.problem-contract"
      ]
    },
    {
      "id": "ground.signed-provenance",
      "stage": "GROUND",
      "tier": "E1_REPRODUCED",
      "title": "Signed subject-bound provenance",
      "prerequisites": [
        "ground.problem-contract"
      ],
      "requirement_ids": [
        "ground.signed-provenance"
      ]
    },
    {
      "id": "ground.rollback-safety",
      "stage": "GROUND",
      "tier": "E1_REPRODUCED",
      "title": "Reversible release procedure",
      "prerequisites": [
        "ground.problem-contract"
      ],
      "requirement_ids": [
        "ground.rollback-safety"
      ]
    },
    {
      "id": "standard.slsa-build-l2",
      "stage": "CAPABILITY",
      "tier": "E2_CONFORMANT",
      "title": "SLSA Build L2 profile",
      "prerequisites": [
        "ground.signed-provenance",
        "ground.rollback-safety"
      ],
      "requirement_ids": [
        "standard.slsa-build-l2"
      ]
    },
    {
      "id": "capability.independent-rebuild",
      "stage": "CAPABILITY",
      "tier": "E2_CONFORMANT",
      "title": "Independent Linux AMD64 rebuild",
      "prerequisites": [
        "standard.slsa-build-l2"
      ],
      "requirement_ids": [
        "capability.independent-rebuild"
      ]
    },
    {
      "id": "capability.causal-gain",
      "stage": "CAPABILITY",
      "tier": "E3_CAUSAL",
      "title": "Causal held-out capability gain",
      "prerequisites": [
        "capability.independent-rebuild"
      ],
      "requirement_ids": [
        "capability.causal-gain"
      ]
    },
    {
      "id": "industrial.interoperability",
      "stage": "INDUSTRIAL",
      "tier": "E4_TRANSFERRED",
      "title": "Independent consumer interoperability",
      "prerequisites": [
        "capability.causal-gain"
      ],
      "requirement_ids": [
        "industrial.interoperability"
      ]
    },
    {
      "id": "industrial.production-slo",
      "stage": "INDUSTRIAL",
      "tier": "E4_TRANSFERRED",
      "title": "Production SLO and guardrail survival",
      "prerequisites": [
        "industrial.interoperability"
      ],
      "requirement_ids": [
        "industrial.production-slo"
      ]
    },
    {
      "id": "industrial.rollback-drill",
      "stage": "INDUSTRIAL",
      "tier": "E4_TRANSFERRED",
      "title": "Production rollback drill",
      "prerequisites": [
        "industrial.production-slo"
      ],
      "requirement_ids": [
        "industrial.rollback-drill"
      ]
    },
    {
      "id": "industrial.independent-adoption",
      "stage": "INDUSTRIAL",
      "tier": "E4_TRANSFERRED",
      "title": "Three-cluster independent adoption",
      "prerequisites": [
        "industrial.rollback-drill"
      ],
      "requirement_ids": [
        "industrial.independent-adoption"
      ]
    },
    {
      "id": "recursive.useful-work",
      "stage": "RECURSIVE",
      "tier": "E5_REUSED",
      "title": "Reusable inward Zerone capability",
      "prerequisites": [
        "industrial.independent-adoption"
      ],
      "requirement_ids": [
        "recursive.useful-work"
      ]
    },
    {
      "id": "crown.constructive-adaptation",
      "stage": "CROWN",
      "tier": "E5_REUSED",
      "title": "Industrial constructive adaptation",
      "prerequisites": [
        "industrial.independent-adoption",
        "recursive.useful-work"
      ],
      "requirement_ids": []
    }
  ],
  "crown_node_id": "crown.constructive-adaptation",
  "challenge_policy": {
    "unresolved_challenge_blocks_crown": true
  },
  "economics": {
    "mode": "NONE",
    "amount_uzrn": "0"
  }
}
